{
  "answer": {
    "verdict": "good",
    "best_window": {
      "day": "2026-09-03",
      "start_hour": 6,
      "end_hour": 11,
      "score": 97.4
    },
    "reason": "Bu hafta koşu için uygun zamanlar; Pazartesi günü altı ile on bir arasında, Cumartesi günü altı ile öğle arasında, Salı günü altı ile on bir arasında, Çarşamba günü altı ile öğle arasında ve Cuma günü altı ile on bir arasında.",
    "warnings": []
  },
  "tool_calls": [
    "get_activity_windows"
  ],
  "duration_ms": 32409,
  "from_model": true,
  "fallback_reason": null,
  "on_device": true
}
